{
  "schema_version": "2.0",
  "before_hash": "sha256:aaaaaaaaaaaaaaaaaaaaaaaaaaaaaaaaaaaaaaaaaaaaaaaaaaaaaaaaaaaaaaaa",
  "after_hash": "sha256:bbbbbbbbbbbbbbbbbbbbbbbbbbbbbbbbbbbbbbbbbbbbbbbbbbbbbbbbbbbbbbbb",
  "changes": [
    {
      "field": "tool",
      "tool_name": "status",
      "change_type": "added",
      "before_hash": "sha256:cccccccccccccccccccccccccccccccccccccccccccccccccccccccccccccccc",
      "after_hash": "sha256:dddddddddddddddddddddddddddddddddddddddddddddddddddddddddddddddd",
      "evidence_state": "pass",
      "decision": "review-required"
    }
  ],
  "instruction_findings": [],
  "remote_descriptor_changes": [],
  "security_checks": [
    {"check": "shadowed-names", "evidence_state": "pass", "decision": "allow", "evidence": []},
    {"check": "scope-expansion", "evidence_state": "pass", "decision": "allow", "evidence": []},
    {"check": "hidden-instructions", "evidence_state": "pass", "decision": "allow", "evidence": []},
    {"check": "token-passthrough", "evidence_state": "pass", "decision": "allow", "evidence": []},
    {"check": "remote-mutability", "evidence_state": "pass", "decision": "allow", "evidence": []},
    {"check": "destructive-capability-addition", "evidence_state": "pass", "decision": "allow", "evidence": []}
  ],
  "evidence_state": "pass",
  "decision": "review-required"
}
